{
  "name": "video_download",
  "version": "1.0.0",
  "description": "Download a video from a URL using yt-dlp",
  "implementations": {
    "python": "tool.py"
  },
  "author": {
    "github": "sentient-community"
  },
  "category": "media",
  "tags": [
    "video",
    "download",
    "yt-dlp",
    "youtube",
    "url"
  ],
  "parameters": [
    {
      "name": "url",
      "type": "string",
      "description": "URL of the video to download",
      "required": true
    },
    {
      "name": "output_path",
      "type": "string",
      "description": "Path where the downloaded video will be saved",
      "required": true
    },
    {
      "name": "format",
      "type": "string",
      "description": "Video format or yt-dlp format selector (e.g. 'mp4', 'best', 'bestvideo+bestaudio')",
      "required": false,
      "default": "best"
    }
  ],
  "requires_api_key": false,
  "dependencies": {
    "python": [
      "yt-dlp"
    ]
  }
}
