{
  "name": "window_list",
  "version": "1.0.0",
  "description": "List all open windows on the desktop",
  "implementations": {
    "python": "tool.py"
  },
  "author": {
    "github": "sentient-community"
  },
  "category": "desktop",
  "tags": [
    "window",
    "list",
    "desktop",
    "automation"
  ],
  "parameters": [],
  "requires_api_key": false,
  "dependencies": {
    "python": [
      "pyautogui"
    ]
  }
}
