{
  "name": "qr_code_read",
  "version": "1.0.0",
  "description": "Read and decode a QR code from an image file",
  "implementations": {
    "python": "tool.py"
  },
  "author": {
    "github": "sentient-community"
  },
  "category": "visualization",
  "tags": [
    "qr",
    "qrcode",
    "decode",
    "read",
    "scan",
    "image",
    "visualization"
  ],
  "parameters": [
    {
      "name": "image_path",
      "type": "string",
      "description": "Path to the image file containing a QR code",
      "required": true
    }
  ],
  "requires_api_key": false,
  "dependencies": {
    "python": [
      "Pillow",
      "opencv-python",
      "pyzbar"
    ]
  }
}
